,id,conversation_id,created_at,date,time,timezone,user_id,username,name,place,tweet,language,mentions,urls,photos,replies_count,retweets_count,likes_count,hashtags,cashtags,link,retweet,quote_url,video,thumbnail,near,geo,source,user_rt_id,user_rt,retweet_id,reply_to,retweet_date,translate,trans_src,trans_dest
0,1587595189249576962,1578344096938487808,2022-11-02 00:59:23 W. Europe Standard Time,2022-11-02,00:59:23,100,1095680615263932416,fabrizi89066475,FabrizioI.,,"@Nero_Tulip @BBlunoir Purtroppo il popolo di milioni e milioni di evasori che vota Meloni e Salvini ha una marea di contanti in tasca. Il loro problema non è tanto pagare le bollette, quanto riuscire a pagarle in contanti. E su questo la Meloni li sta facendo felici.",it,[],[],[],0,0,1,[],[],https://twitter.com/Fabrizi89066475/status/1587595189249576962,False,,0,,,,,,,,"[{'screen_name': 'Nero_Tulip', 'name': 'Nero Tulip', 'id': '94397091'}, {'screen_name': 'BBlunoir', 'name': 'blunoir blunoir', 'id': '1540662926004129792'}]",,,,
2,1587594875364687876,1587464242957107200,2022-11-02 00:58:09 W. Europe Standard Time,2022-11-02,00:58:09,100,1087849336241905664,ettore79597694,Ettore🇮🇹🖤,,@ZanAlessandro Speriamo diano un taglio con i gaypride allora! Meloni la mia pdr!,it,[],[],[],1,0,0,[],[],https://twitter.com/Ettore79597694/status/1587594875364687876,False,,0,,,,,,,,"[{'screen_name': 'ZanAlessandro', 'name': 'Alessandro Zan', 'id': '1022254674'}]",,,,
5,1587594571558670336,1587496290253955072,2022-11-02 00:56:56 W. Europe Standard Time,2022-11-02,00:56:56,100,1529605532700614659,_giobs_,Giovanni,,@chiccotesta Colpa di Giorgia Meloni ! Si è permessa di vincere le elezioni politiche e... diventare primo ministro ! Senza il permesso della Boldrini....,it,[],[],[],0,0,0,[],[],https://twitter.com/_Giobs_/status/1587594571558670336,False,,0,,,,,,,,"[{'screen_name': 'chiccotesta', 'name': 'chicco testa', 'id': '38139984'}]",,,,
7,1587594288875163651,1587594288875163648,2022-11-02 00:55:49 W. Europe Standard Time,2022-11-02,00:55:49,100,1475639159008210955,enricosavasta,Enrico Savasta,,"Meloni #fascista! Ah no, è roba fucsia.  https://t.co/dRJjwHDjN7",it,[],['https://www.farodiroma.it/roma-la-polizia-carica-gli-studenti-che-protestano-per-la-morte-di-lorenzo-vasapollo-confindustria-manganelli/'],[],0,0,0,['fascista'],[],https://twitter.com/EnricoSavasta/status/1587594288875163651,False,https://twitter.com/ZanAlessandro/status/1587464242957107204,0,,,,,,,,[],,,,
8,1587594223276199936,1587594223276199936,2022-11-02 00:55:33 W. Europe Standard Time,2022-11-02,00:55:33,100,135803339,ledimiche,michela ledi,,"Top story: Nei bilanci del Twiga c’è l’Italia che piace a Daniela Santanchè e alla destra di Meloni  https://t.co/JgYL5IosxV, see more  https://t.co/a3OkMQzY3X",it,[],"['https://www.editorialedomani.it/fatti/bilanci-twiga-daniela-santanche-ministra-turismo-xazamxyx', 'https://tweetedtimes.com/ledimiche?s=tnp']",[],0,0,0,[],[],https://twitter.com/ledimiche/status/1587594223276199936,False,,0,,,,,,,,[],,,,
11,1587594074588155905,1587594074588155904,2022-11-02 00:54:58 W. Europe Standard Time,2022-11-02,00:54:58,100,1418140394467086337,profumoolga,Olga Profumo,,Basta con questo tipo di liberta che non assomiglia neppure a quella vera e sana. Ma non ci va a Parigi come aveva detto? Falsità sempre. Per fortuna ci guadagna il presidente MELONI coni suoi rosicamenti,it,[],[],[],1,0,1,[],[],https://twitter.com/ProfumoOlga/status/1587594074588155905,False,https://twitter.com/sole24ore/status/1587482671021789186,0,,,,,,,,[],,,,
12,1587594021349822464,1587152076370575360,2022-11-02 00:54:45 W. Europe Standard Time,2022-11-02,00:54:45,100,1364043584,eccalla,La Simo,,@1casopatologico @FratellidItalia @GiorgiaMeloni Il signor Meloni ha messo tutte persone di alto profilo e questa è una delle molte dimostrazioni.,it,[],[],[],0,0,0,[],[],https://twitter.com/Eccalla/status/1587594021349822464,False,,0,,,,,,,,"[{'screen_name': '1casopatologico', 'name': '𝕆𝕤𝕔𝕒𝕣 𝔻𝕒𝕓𝕓𝕒𝕘𝕟𝕠', 'id': '3646356672'}, {'screen_name': 'FratellidItalia', 'name': ""Fratelli d'Italia 🇮🇹"", 'id': '1024976264'}, {'screen_name': 'GiorgiaMeloni', 'name': 'Giorgia Meloni', 'id': '130537001'}]",,,,
13,1587593970607177729,1587420532642877440,2022-11-02 00:54:33 W. Europe Standard Time,2022-11-02,00:54:33,100,1350044246083067904,katia29390546,Katiarossoblu,,"@EnricoLetta Libertà? Quale libertà se ci è stata tolta da due anni e più. X favore, basta con ste critiche insignificanti solo x colpire la Meloni. Ormai vi conosciamo, i buonisti che x farsi belli con gli stranieri hanno calpestato i nostri diritti.",it,[],[],[],0,0,0,[],[],https://twitter.com/Katia29390546/status/1587593970607177729,False,,0,,,,,,,,"[{'screen_name': 'EnricoLetta', 'name': 'Enrico Letta', 'id': '419622371'}]",,,,
14,1587593920493809664,1587593920493809664,2022-11-02 00:54:21 W. Europe Standard Time,2022-11-02,00:54:21,100,737243526983999488,nadiamai4,Nadia MAI,,"Meloni dovrebbe vergognarsi di andare a Bruxelles al posto di Draghi, non perché è di dx, ma perché rappresenta un governo di incapaci (salvo Nordio) assimilabili a grillini e contiani.",it,[],[],[],0,0,1,[],[],https://twitter.com/NadiaMAI4/status/1587593920493809664,False,https://twitter.com/RaffaeleFitto/status/1587377957798117376,0,,,,,,,,[],,,,
15,1587593803929731073,1587593803929731072,2022-11-02 00:53:53 W. Europe Standard Time,2022-11-02,00:53:53,100,395605528,alesceni,Margot,,"L'aumento del tetto al contante servirebbe a comprare in anonimato i gioielli all'amante.  Aiuterebbe i gioielleri di Como e dintorni, in crisi a causa della concorrenza svizzera.   Le priorità del governo Meloni!   Chi lo avrebbe detto?",it,[],[],[],0,0,0,[],[],https://twitter.com/AleSceni/status/1587593803929731073,False,https://twitter.com/borghi_claudio/status/1587572248298258432,0,,,,,,,,[],,,,
16,1587593791946588164,1587593791946588160,2022-11-02 00:53:50 W. Europe Standard Time,2022-11-02,00:53:50,100,1095026626109296640,lacittanews,La Citta News,,"01/11/2022  Decreto rave party, Maurizio Molinari (La Repubblica): ""Meloni sta limitando le libertà civili. L'identità? Forse quella di Galeazzo Bignami che si traveste da nazista, non degli italiani"" Guarda anche   https://t.co/YVM3hoicyE",it,[],['https://lacittanews.it/decreto-rave-party-molinari-meloni-sta-limitando-le-liberta-civili/'],[],0,0,0,[],[],https://twitter.com/lacittanews/status/1587593791946588164,False,,0,,,,,,,,[],,,,
17,1587593658982961152,1587593658982961152,2022-11-02 00:53:19 W. Europe Standard Time,2022-11-02,00:53:19,100,317671787,infoitinterno,informazione interno,,"Navigator, per il governo Meloni non sono prorogabili  https://t.co/uhjtrAbHdr",it,[],['https://www.informazione.it/a/1E2ED405-EB60-433A-821A-36657495CD69/Navigator-per-il-governo-Meloni-non-sono-prorogabili'],[],0,0,0,[],[],https://twitter.com/infoitinterno/status/1587593658982961152,False,,0,,,,,,,,[],,,,
19,1587593392317665281,1587546762058899456,2022-11-02 00:52:15 W. Europe Standard Time,2022-11-02,00:52:15,100,1188843954432811010,loretta88197243,Loretta emiliana che vive in Sicilia),,@giusy_trovato Che la meloni è sempre più fascista..ma questo lo sapevi già!👋🏻👋🏻😘,it,[],[],[],0,0,4,[],[],https://twitter.com/Loretta88197243/status/1587593392317665281,False,,0,,,,,,,,"[{'screen_name': 'giusy_trovato', 'name': 'Mammatrepuntozero', 'id': '1130917656'}]",,,,
0,1587957340866756610,1587957340866756608,2022-11-03 00:58:27 W. Europe Standard Time,2022-11-03,00:58:27,100,1396129968938229764,antonio65683279,antonio palazzo,,Ecco quale è il problema della Meloni: un mix di ignoranza e ideologia  https://t.co/LWSAXjp0LA via @ilriformista,it,"[{'screen_name': 'ilriformista', 'name': 'il riformista', 'id': '138736601'}]",['https://www.ilriformista.it/ecco-quale-e-il-problema-della-meloni-un-mix-di-ignoranza-e-ideologia-327471/'],[],1,0,3,[],[],https://twitter.com/antonio65683279/status/1587957340866756610,False,,0,,,,,,,,[],,,,
1,1587957045843599360,1587904997290917888,2022-11-03 00:57:17 W. Europe Standard Time,2022-11-03,00:57:17,100,1556676560450625536,stevacca71,Stefano,,@camiziani @BenedettaFrucci @mattiafeltri forse Meloni e Salvini,it,[],[],[],0,0,0,[],[],https://twitter.com/SteVacca71/status/1587957045843599360,False,,0,,,,,,,,"[{'screen_name': 'camiziani', 'name': 'camiziani 🏳️\u200d🌈 🇺🇦', 'id': '1323023005304430592'}, {'screen_name': 'BenedettaFrucci', 'name': 'Benedetta Frucci', 'id': '170739225'}, {'screen_name': 'mattiafeltri', 'name': 'mattia feltri', 'id': '482897816'}]",,,,
2,1587956945738252289,1587956945738252288,2022-11-03 00:56:53 W. Europe Standard Time,2022-11-03,00:56:53,100,53046364,gianfreee,UNEmployed,,Certo che un mondiale senza la nazionale italiana deve essere uno smacco per la Meloni e la propaganda nazionalista.,it,[],[],[],0,0,0,[],[],https://twitter.com/GianFreee/status/1587956945738252289,False,,0,,,,,,,,[],,,,
5,1587956616938377217,1587956616938377216,2022-11-03 00:55:34 W. Europe Standard Time,2022-11-03,00:55:34,100,766361393281036288,bigdarktiger,Marco,,"Disastro Draghi, spuntano i numeri della gestione: consegna alla Meloni ...  https://t.co/sUpvD5nLSf via @YouTube",it,"[{'screen_name': 'youtube', 'name': 'youtube', 'id': '10228272'}]",['https://youtu.be/ADm6Z9xdjUY'],[],0,0,0,[],[],https://twitter.com/bigdarktiger/status/1587956616938377217,False,,0,,,,,,,,[],,,,
6,1587956606951636992,1587956606951636992,2022-11-03 00:55:32 W. Europe Standard Time,2022-11-03,00:55:32,100,1396129968938229764,antonio65683279,antonio palazzo,,"Soccorrere è il dovere n. 1, ma gli sbarchi devono finire. Intervenga l'Europa con i Paesi di partenza. Migranti, Berlino a Meloni: ""Italia presti velocemente soccorso a navi""  https://t.co/A0ogF2DvFX via @repubblica",it,"[{'screen_name': 'repubblica', 'name': 'repubblica', 'id': '18935802'}]",['https://www.repubblica.it/politica/2022/11/02/news/migranti_germania_meloni_italia_ong_navi-372693607/?ref=RHLF-BG-I372696756-P2-S1-T1&__vfz=medium%3Dsharebar'],[],0,0,0,[],[],https://twitter.com/antonio65683279/status/1587956606951636992,False,,0,,,,,,,,[],,,,
7,1587956573305016326,1587702535984484352,2022-11-03 00:55:24 W. Europe Standard Time,2022-11-03,00:55:24,100,1441025532678721543,luisakaty76,Milanesi Maddalena,,"@Corriere muto conte,muto,tu ne sai più della meloni ,di stato di polizia.",it,[],[],[],0,0,0,[],[],https://twitter.com/luisakaty76/status/1587956573305016326,False,,0,,,,,,,,"[{'screen_name': 'Corriere', 'name': 'Corriere della Sera', 'id': '395218906'}]",,,,
8,1587956417901826049,1586019448309547008,2022-11-03 00:54:47 W. Europe Standard Time,2022-11-03,00:54:47,100,1489345677532577796,ariete4620,Ariete4620,,"@ZanAlessandro Ognuno è libero di farsi chiamare come c..zo gli - le pare, specie IL PRESIDENTE DEL CONSIGLIO MELONI! Non per questo, in una posizione di potere l’autorevolezza deve essere rappresentata da un  uomo! Ricordiamoci DEL PRESIDENTE  del Senato CASELLATI!🤔",it,[],[],[],0,0,0,[],[],https://twitter.com/Ariete4620/status/1587956417901826049,False,,0,,,,,,,,"[{'screen_name': 'ZanAlessandro', 'name': 'Alessandro Zan', 'id': '1022254674'}]",,,,
9,1587956337845100545,1587808173620170752,2022-11-03 00:54:28 W. Europe Standard Time,2022-11-03,00:54:28,100,917500226268811266,paullamanski,🇮🇹🇸🇳🇪🇺🇵🇸 Paul Lamanski 🇵🇸🇪🇺🇸🇳🇮🇹,,"@PieroSansonetti Se quelle merde di rete4, tg4, diritto e rovescio ecc non avessero pubblicizzato la meloni, ora non avremo sto stronzo di bignami in politica. Tu dirai: e ma non puoi censurare la tv. Devi invece quando sai che gli spettatori  delle suddette porcherie, sono dei deficienti.",it,[],[],[],0,0,0,[],[],https://twitter.com/PaulLamanski/status/1587956337845100545,False,,0,,,,,,,,"[{'screen_name': 'PieroSansonetti', 'name': 'PieroSansonetti', 'id': '501813967'}]",,,,
10,1587956163420758021,1587956163420758016,2022-11-03 00:53:46 W. Europe Standard Time,2022-11-03,00:53:46,100,443303708,giovasesterzio,S.L.,,"Se ci fossero i rave party a Capalbio, la sinistra darebbe ragione alla Meloni.",it,[],[],[],1,3,14,[],[],https://twitter.com/GiovaSesterzio/status/1587956163420758021,False,,0,,,,,,,,[],,,,
12,1587956012824371201,1587895239057997824,2022-11-03 00:53:10 W. Europe Standard Time,2022-11-03,00:53:10,100,2419772543,eedaii,Io.. :),,"@mariolavia brava Meloni, avanti così!",it,[],[],[],0,0,0,[],[],https://twitter.com/Eedaii/status/1587956012824371201,False,,0,,,,,,,,"[{'screen_name': 'mariolavia', 'name': 'Mario Lavia', 'id': '267174899'}]",,,,
13,1587955698985574400,1587942948087504896,2022-11-03 00:51:56 W. Europe Standard Time,2022-11-03,00:51:56,100,341266517,ilianragman,Ilian Ragman,,"@petronillarusso @nonsonpago1 @maurobiani @repubblica La storia antica nn c'entra è proprio qua il male, anche l'on. Fini fascista dichiarato, è inorridito e spaventato a questa che nn è piu da un po mera eventualita storica ma una orribile e spinosa relata attuale. crolla la meloni e crolla tutto l'apparato, il problema che è donna",it,[],[],[],0,0,1,[],[],https://twitter.com/IlianRagman/status/1587955698985574400,False,,0,,,,,,,,"[{'screen_name': 'petronillarusso', 'name': 'Nellarusso', 'id': '2866061393'}, {'screen_name': 'nonsonpago1', 'name': 'nonsonpago', 'id': '2303644001'}, {'screen_name': 'maurobiani', 'name': 'Mauro Biani', 'id': '8001112'}, {'screen_name': 'repubblica', 'name': 'Repubblica', 'id': '18935802'}]",,,,
16,1587955292104527872,1587955292104527872,2022-11-03 00:50:19 W. Europe Standard Time,2022-11-03,00:50:19,100,239736419,bizcommunityit,Business Community,,"Premier a Bruxelles, Giorgia Meloni è pronta alla missione in Europa  https://t.co/m3DwwID2M3",it,[],['https://news.google.com/__i/rss/rd/articles/CBMikwFodHRwczovL3d3dy5pbHRlbXBvLml0L3BvbGl0aWNhLzIwMjIvMTEvMDIvbmV3cy9naW9yZ2lhLW1lbG9uaS1wcm9udGEtbWlzc2lvbmUtZXVyb3BhLXJvYmVydGEtbWV0c29sYS11cnN1bGEtdm9uLWRlci1sZXllbi1jaGFybGVzLW1pY2hlbC0zMzcxMzQ2NS_SAQA?oc=5'],[],0,0,0,[],[],https://twitter.com/bizcommunityit/status/1587955292104527872,False,,0,,,,,,,,[],,,,
19,1587955167122845696,1587955167122845696,2022-11-03 00:49:49 W. Europe Standard Time,2022-11-03,00:49:49,100,1021422990,tinasaraceni1,tinasaraceni,,"Letta-Meloni, il faccia a faccia: l'immigrazione  https://t.co/mOUVXhwX3f via @YouTube",it,"[{'screen_name': 'youtube', 'name': 'youtube', 'id': '10228272'}]",['https://youtu.be/R3i33lgE2Rk'],[],0,0,0,[],[],https://twitter.com/tinasaraceni1/status/1587955167122845696,False,,0,,,,,,,,[],,,,
22,1587954954815299591,1587923784635678720,2022-11-03 00:48:58 W. Europe Standard Time,2022-11-03,00:48:58,100,1480940741010538500,lauragi63815697,Laura Giordano 🇮🇹☮️ #noPD #exM5S,,@AdrianaSpappa @vitalbaa Meloni vuole soffocare il dissenso che sa che presto le pioverà addosso!,it,[],[],[],1,0,1,[],[],https://twitter.com/LauraGi63815697/status/1587954954815299591,False,,0,,,,,,,,"[{'screen_name': 'AdrianaSpappa', 'name': 'Adriana Spappa', 'id': '1053258748230332416'}, {'screen_name': 'vitalbaa', 'name': 'Vitalba Azzollini', 'id': '46224994'}]",,,,
24,1587954926881234944,1587687353262432256,2022-11-03 00:48:52 W. Europe Standard Time,2022-11-03,00:48:52,100,806154403162062848,hayertalbema3ak,Ali Hamie علوش 🇱🇧,,@fra852 @Petra71301259 @CaterinaCategio @albertopetro2 @LunaLeso @migliaccio31 @DavLucia @agustin_gut @dianadep1 @RitangelaPrivi1 @djolavarrieta @GerardLDonadoni @Messe11 @cecchi_giovanna @PaolaToogoodxme @AntonellaLaTor6 @ValerioLivia @Titas37 @paoloigna1 @guagnano_paolo @SgherriSimona @Sensibilia8 @ANNAMAMARIABIA1 @AnnaCountessK @MarisaPetrina @yianniseinstein @marmelyr @xaloc7 @Rebeka80721106 @smarucci461 @BryanMatthews23 @anne_camozzi @ManuelaDora @doritadia @albert_cunill @GiuseppeTurrisi @hayertalbe @Mam95616872 @revove22454 @ritamay1 @licprospero Buona Notte Meloni Ti Auguro Sogni d'Oro 💐🙏🌠🍂🌧🍁  https://t.co/pRF2MFYrHp,it,[],[],['https://pbs.twimg.com/media/FgmMlzDWQAA8WGO.jpg'],0,0,2,[],[],https://twitter.com/hayertalbema3ak/status/1587954926881234944,False,,1,https://pbs.twimg.com/media/FgmMlzDWQAA8WGO.jpg,,,,,,,"[{'screen_name': 'fra852', 'name': 'meloni franca', 'id': '993249822'}, {'screen_name': 'Petra71301259', 'name': 'Petra', 'id': '1172533636027097088'}, {'screen_name': 'CaterinaCategio', 'name': 'Caterina Giovanardi', 'id': '2273338778'}, {'screen_name': 'albertopetro2', 'name': 'Alberto Petroccione', 'id': '1644683106'}, {'screen_name': 'LunaLeso', 'name': 'Luna Eventi Speciali', 'id': '1101600720'}, {'screen_name': 'migliaccio31', 'name': 'erminia rubulotta', 'id': '2401896174'}, {'screen_name': 'DavLucia', 'name': 'lucia davi', 'id': '804190579'}, {'screen_name': 'agustin_gut', 'name': 'Agustín González Gut', 'id': '3346433337'}, {'screen_name': 'dianadep1', 'name': 'Diana☀️', 'id': '258834617'}, {'screen_name': 'RitangelaPrivi1', 'name': 'Angelatrenipoti', 'id': '1515726435679354889'}, {'screen_name': 'djolavarrieta', 'name': 'Dionisio Olavarrieta', 'id': '741730393154453504'}, {'screen_name': 'Messe11', 'name': 'Alfredo Messeguer C', 'id': '259006548'}, {'screen_name': 'cecchi_giovanna', 'name': 'giovanna cecchi', 'id': '902394874367967232'}, {'screen_name': 'PaolaToogoodxme', 'name': 'Paola Cingolani', 'id': '468129321'}, {'screen_name': 'AntonellaLaTor6', 'name': 'Antonella La Torre', 'id': '736257667568635904'}, {'screen_name': 'ValerioLivia', 'name': 'Livia Valerio', 'id': '2793244697'}, {'screen_name': 'Titas37', 'name': 'Benito -', 'id': '4863045456'}, {'screen_name': 'paoloigna1', 'name': 'paolo ignazio marong', 'id': '1341462944'}, {'screen_name': 'guagnano_paolo', 'name': 'Paolo Guagnano', 'id': '2892254642'}, {'screen_name': 'SgherriSimona', 'name': 'gioSimona Sgherri', 'id': '1151413412'}, {'screen_name': 'Sensibilia8', 'name': '~Sensibility~', 'id': '1246920812336238594'}, {'screen_name': 'ANNAMAMARIABIA1', 'name': 'Annamaria Biasini', 'id': '2744793617'}, {'screen_name': 'AnnaCountessK', 'name': 'Countess Anna', 'id': '797818065215860736'}, {'screen_name': 'MarisaPetrina', 'name': 'Marisa Petrina', 'id': '2834396973'}, {'screen_name': 'yianniseinstein', 'name': 'Yiannis Einstein-Ιωάννης Αρβανιτάκης', 'id': '533331937'}, {'screen_name': 'marmelyr', 'name': 'Marmely R. Ramos Donís', 'id': '131272764'}, {'screen_name': 'xaloc7', 'name': 'Charo García', 'id': '165774241'}, {'screen_name': 'Rebeka80721106', 'name': 'Rebeka', 'id': '810476391674290177'}, {'screen_name': 'smarucci461', 'name': 'Silvana Marucci', 'id': '952571060649590784'}, {'screen_name': 'BryanMatthews23', 'name': 'Bryan Matthews', 'id': '1018730588117688321'}, {'screen_name': 'anne_camozzi', 'name': 'Anne Camozzi ©️', 'id': '793848526018981889'}, {'screen_name': 'ManuelaDora', 'name': 'Manuela Dora', 'id': '374141526'}, {'screen_name': 'doritadia', 'name': 'dorita dia', 'id': '717220159'}, {'screen_name': 'albert_cunill', 'name': 'Albert Cunill', 'id': '3140033687'}, {'screen_name': 'GiuseppeTurrisi', 'name': 'AnimaLunga™', 'id': '427344695'}, {'screen_name': 'hayertalbe', 'name': 'Ali hamie علوش (N* 2 account)', 'id': '776190978403164160'}, {'screen_name': 'revove22454', 'name': 'charles newell', 'id': '980453753559056386'}, {'screen_name': 'ritamay1', 'name': 'Rita Hunter', 'id': '240260928'}, {'screen_name': 'licprospero', 'name': 'Patricia Prospero', 'id': '359096965'}]",,,,
25,1587954917469290497,1587954917469290496,2022-11-03 00:48:49 W. Europe Standard Time,2022-11-03,00:48:49,100,77823743,aureliomancuso,Aurelio Mancuso,,"La #PresidentedelConsiglio @GiorgiaMeloni ha detto: “…vorrei rassicurare tutti i cittadini - qualora ce ne fosse bisogno - che non negheremo a nessuno di esprimere il dissenso"". Guardi #Meloni la libertà di espressione la garantisce la Costituzione non è una sua concessione!",it,"[{'screen_name': 'giorgiameloni', 'name': 'giorgia meloni', 'id': '130537001'}]",[],[],3,7,27,"['presidentedelconsiglio', 'meloni']",[],https://twitter.com/aureliomancuso/status/1587954917469290497,False,,0,,,,,,,,[],,,,
26,1587954797306867712,1587860573886332928,2022-11-03 00:48:21 W. Europe Standard Time,2022-11-03,00:48:21,100,1257444691114635267,imillilitro,Il millilitro,,"@ultimora_pol Giorgia Meloni: ""basta bonus! le priorità sono ben altre!"" Sempre Giorgia Meloni: *fa il bonus cinema 👁️👄👁️  https://t.co/AC2nGLm2En",it,[],[],['https://pbs.twimg.com/media/FgmMeLQXoAEj1su.jpg'],0,0,3,[],[],https://twitter.com/IMillilitro/status/1587954797306867712,False,,1,https://pbs.twimg.com/media/FgmMeLQXoAEj1su.jpg,,,,,,,"[{'screen_name': 'ultimora_pol', 'name': 'Ultimora.net - POLITICS', 'id': '1300916262369984515'}]",,,,
27,1587954459883278342,1587954459883278336,2022-11-03 00:47:00 W. Europe Standard Time,2022-11-03,00:47:00,100,1567292401181409280,maina_enrica,Enrica Maina,,"Altro giorno sbuca ancora Francesco. X video Emilia Romagna di Salvini vestita come lui è imita là premier Meloni, paragonare oro con la merda Francesca   https://t.co/WdQnvEWPXL",it,[],['https://youtu.be/8uYwbBM-fH0'],[],0,0,0,[],[],https://twitter.com/maina_enrica/status/1587954459883278342,False,,0,,,,,,,,[],,,,
28,1587954341494882307,1587954341494882304,2022-11-03 00:46:32 W. Europe Standard Time,2022-11-03,00:46:32,100,114300672,piergiulio58,Piergiulio 🚴🏻‍♂️🌵,,"Fino a 10 miliardi per le bollette. Tajani: 'Priorità per famiglie e imprese'. Cresce il tesoretto a disposizione del governo grazie anche dall'andamento del Pil. 'I pochi soldi che ci sono li useremo per le bollette', ha detto la Premier Meloni.  https://t.co/H9RZfSFyqT",it,[],['https://www.ansa.it/sito/notizie/politica/2022/11/02/fino-a-10-miliardi-per-le-bollette.-tajani-priorita-per-famiglie-e-imprese_f20861d7-ddd8-46ed-b37d-943e602d8295.html'],[],0,0,0,[],[],https://twitter.com/Piergiulio58/status/1587954341494882307,False,,0,,,,,,,,[],,,,
29,1587954224045985794,1587937192294641664,2022-11-03 00:46:04 W. Europe Standard Time,2022-11-03,00:46:04,100,717894055405961216,rosy87234986,Rosy,,"@Controcorrentv @EleonoraCamilli Che giornalismo becero! Che significa identitario? Che attua quanto votato da elettori di Meloni e Salvini? E che dovrebbero fare? Attuare il programma PD? Ma perché la Spagna,di sinistra,può respingere i clandestini,multare le ong(900.000€) e sequestrare gli scafi? Ipocriti!  https://t.co/INTn0TwNzS",it,[],[],['https://pbs.twimg.com/media/FgmL86cXgAQbxXl.jpg'],0,0,0,[],[],https://twitter.com/Rosy87234986/status/1587954224045985794,False,,1,https://pbs.twimg.com/media/FgmL86cXgAQbxXl.jpg,,,,,,,"[{'screen_name': 'Controcorrentv', 'name': 'Controcorrente', 'id': '1448212490714853383'}, {'screen_name': 'EleonoraCamilli', 'name': 'Eleonora Camilli', 'id': '903898838'}]",,,,
30,1587954038468911105,1587954038468911104,2022-11-03 00:45:20 W. Europe Standard Time,2022-11-03,00:45:20,100,1379473473714675718,annamariaperr16,Annamaria Perrone,,...per favore...occupiamoci anche di quello che avviene nel resto del mondo.. Meloni.. Meloni.. Meloni.. Che nausea!!! #lineanotte,it,[],[],[],1,1,2,['lineanotte'],[],https://twitter.com/AnnamariaPerr16/status/1587954038468911105,False,,0,,,,,,,,[],,,,
33,1587953589808496641,1587953589808496640,2022-11-03 00:43:33 W. Europe Standard Time,2022-11-03,00:43:33,100,626501000,loop_us,Stee_cats,,In pratica la Meloni è la versione femminile di Salvini solo che legge un po' di più ed è un po' più scaltra informandosi con chi di dovere per non farsi prendere in contropiede Ma il peso specifico è identico linguaggio e strategia a parte,it,[],[],[],0,0,0,[],[],https://twitter.com/loop_us/status/1587953589808496641,False,,0,,,,,,,,[],,,,
34,1587953542022807553,1587726113035501568,2022-11-03 00:43:21 W. Europe Standard Time,2022-11-03,00:43:21,100,1052861531736674304,fertgiuseppe,Giuseppe Fert 🇮🇹🇷🇺🇺🇸🇧✝️ #IStandWithDonbass,,"@Samira1577 @LucioMalan Rave, Giorgia Meloni: ""Rivendico la norma, non negheremo diritto a esprimere dissenso"" Il ministro Nordio assicura: ""La legge non incide sui diritti d'espressione"" https://t.co/qvKbCuctI5",it,[],['https://www.tgcom24.mediaset.it/politica/rave-giorgia-meloni-norma_56831135-202202k.shtml'],[],1,0,0,[],[],https://twitter.com/FertGiuseppe/status/1587953542022807553,False,,0,,,,,,,,"[{'screen_name': 'Samira1577', 'name': 'Cinica #liberiamocidailiberisti🇮🇹', 'id': '1219944530'}, {'screen_name': 'LucioMalan', 'name': 'Lucio Malan', 'id': '919526072'}]",,,,
36,1587953463740465152,1587953463740465152,2022-11-03 00:43:03 W. Europe Standard Time,2022-11-03,00:43:03,100,1473483275821850626,fissotiro,@TIRO_FISSO (#FreeAssangeNOW),,"Se Giorgia Meloni fosse una persona seria, darebbe seguito al suo nazionalismo obbligando le aziende Italiane a pagare le tasse in Italia. Invece no. La destra Italiana, col tricolore in mano, e il conto a Lugano. Business as usual.",it,[],[],[],0,0,0,[],[],https://twitter.com/FissoTiro/status/1587953463740465152,False,,0,,,,,,,,[],,,,
37,1587953438100447239,1587953438100447232,2022-11-03 00:42:57 W. Europe Standard Time,2022-11-03,00:42:57,100,1404121928571490305,mattiamattiaaa,Mattia Pellegrino,,"[L’editoriale di quest’oggi, giovedì 3 novembre, di Marco Travaglio, sul Fatto].   “La comica finale sono Meloni e Tajani che si vantano di avere sventato le intercettazioni. E non sanno che sono consentite per i reati sopra i 5 anni di pena,   1/3   &gt;&gt;&gt;&gt;&gt;",it,[],[],[],1,0,2,[],[],https://twitter.com/mattiamattiaaa/status/1587953438100447239,False,https://twitter.com/pengueraffaele/status/1587945868828626944,0,,,,,,,,[],,,,
38,1587953413345746947,1587953413345746944,2022-11-03 00:42:51 W. Europe Standard Time,2022-11-03,00:42:51,100,1165956572540997634,inter_rompi,Inter_Rompi® - #IoStoConPaoloZiliani,,"""non mi farò curare da un medico non inoculato"" è il nuovo ""se vince Meloni, lascio l'Italia""",it,[],[],[],0,0,2,[],[],https://twitter.com/Inter_Rompi/status/1587953413345746947,False,,0,,,,,,,,[],,,,
