,id,conversation_id,created_at,date,time,timezone,user_id,username,name,place,tweet,language,mentions,urls,photos,replies_count,retweets_count,likes_count,hashtags,cashtags,link,retweet,quote_url,video,thumbnail,near,geo,source,user_rt_id,user_rt,retweet_id,reply_to,retweet_date,translate,trans_src,trans_dest
69,1602805788849967108,1602805788849967104,2022-12-14 00:20:53 W. Europe Standard Time,2022-12-14,00:20:53,100,1505176801496252431,manovele21,Manovele,,@peppeprovenzano EGREGIO SIGNOR Provenzano lei questa sera  A porta a porta a DICHIARATO che il partito DEMOCRATICO e un grande partito PERSONALMENTE il partito DEMOCRATICO non è siste più no vi RESTA di CRITICARE il GOVERNO MELONI a mio parere GIORGIA MELONI sta GUARDANDO bene,it,[],[],[],0,0,0,[],[],https://twitter.com/Manovele21/status/1602805788849967108,False,,0,,,,,,,,[],,,,
71,1602805472058286080,1602586439199358976,2022-12-14 00:19:37 W. Europe Standard Time,2022-12-14,00:19:37,100,1576249516612894720,ghinodibass,Ghino di Tacco,,"@robertosaviano E niente ..persino alla soglia dell'ennesima condanna, perché lei sarà condannato questo è sicuro, le carte parlano chiaro, il suo ego la porta a straparlare. Ma quando  si renderà conto finalmente di essere un mediocre scrittore, anzi copiatore? #Saviano  #Meloni",it,[],[],[],0,1,3,"['saviano', 'meloni']",[],https://twitter.com/Ghinodibass/status/1602805472058286080,False,,0,,,,,,,,"[{'screen_name': 'robertosaviano', 'name': 'Roberto Saviano', 'id': '14516324'}]",,,,
73,1602805257544892418,1602624682330624000,2022-12-14 00:18:46 W. Europe Standard Time,2022-12-14,00:18:46,100,1101974991216799746,jameszaky,JTS 👨‍🏫➕👨‍🔬✖️🇮🇹➕🇲🇨 = 🇬🇧🏳️‍🌈,,@MarcoFattorini ma non è affatto incostituzionale. La Meloni ha detto na boiata,it,[],[],[],0,0,0,[],[],https://twitter.com/JamesZaky/status/1602805257544892418,False,,0,,,,,,,,"[{'screen_name': 'MarcoFattorini', 'name': 'Marco Fattorini', 'id': '386800314'}]",,,,
74,1602805257297338371,1602613754553925632,2022-12-14 00:18:46 W. Europe Standard Time,2022-12-14,00:18:46,100,1030062324168704000,lorenzo31646976,Lorenzo,,"@pdnetwork Ci fu il cash back che incentivava l'uso delle carte a discapito del contante, ma poi arrivò draghi che lo distrusse col vostro felice appoggio ora la Meloni continua l'opera ""del migliore""",it,[],[],[],0,0,1,[],[],https://twitter.com/Lorenzo31646976/status/1602805257297338371,False,,0,,,,,,,,"[{'screen_name': 'pdnetwork', 'name': 'Partito Democratico 🇮🇹 🇪🇺', 'id': '13294452'}]",,,,
76,1602804989163982851,1602591371109474304,2022-12-14 00:17:42 W. Europe Standard Time,2022-12-14,00:17:42,100,4432360889,lindaeciao,Linda,,@angy_angy67 @meloni Pochette nera😂😂,it,[],[],[],0,0,0,[],[],https://twitter.com/lindaeciao/status/1602804989163982851,False,,0,,,,,,,,"[{'screen_name': 'angy_angy67', 'name': 'Angy', 'id': '3300539086'}, {'screen_name': 'meloni', 'name': 'meloni', 'id': '16213677'}]",,,,
77,1602804947220766721,1602804947220766720,2022-12-14 00:17:32 W. Europe Standard Time,2022-12-14,00:17:32,100,546698904,barramaurizio,Maurizio Barra,,"Crisi alimentare, Meloni: ""Non consentiamo che Putin la usi come arma""  https://t.co/2S3gEM01B2",it,[],['https://tuttonotizie.net/2022/12/14/crisi-alimentare-meloni-non-consentiamo-che-putin-la-usi-come-arma/'],[],0,0,0,[],[],https://twitter.com/barramaurizio/status/1602804947220766721,False,,0,,,,,,,,[],,,,
78,1602804838932578304,1602791728586563584,2022-12-14 00:17:06 W. Europe Standard Time,2022-12-14,00:17:06,100,1492203448296787973,__ant_z___,Z come 🐜,,"@GiovaQuez @GiovaQuez NICOLA PORRO vedeva TERRORISMO negli articoli su un bambino morto di covid...  Giorgia Meloni che non vedeva GINEVRA,COME SUA FIGLIA,morta pochi giorni dopo quel bambino... Fulmine selettivo.  AL GOVERNO DISCRIMINANDO CHI NON CORRELATO AL GREEN PASS....  https://t.co/jaXP1hmNy7",it,[],[],"['https://pbs.twimg.com/media/Fj5OfFnXgAMstBy.jpg', 'https://pbs.twimg.com/media/Fj5OfhYXoAIUhpO.jpg', 'https://pbs.twimg.com/media/Fj5Of8LWAAMWU0I.png', 'https://pbs.twimg.com/media/Fj5OgZnWAAQFsfB.png']",0,0,0,[],[],https://twitter.com/__ANT_Z___/status/1602804838932578304,False,,1,https://pbs.twimg.com/media/Fj5OfFnXgAMstBy.jpg,,,,,,,"[{'screen_name': 'GiovaQuez', 'name': 'Giovanni Rodriquez', 'id': '1216857073'}]",,,,
79,1602804775703220225,1602658551134027776,2022-12-14 00:16:51 W. Europe Standard Time,2022-12-14,00:16:51,100,1288968512,naladrof53,conteoliver53,,@Libero_official La classe non è acqua. D'altra parte vogliamo paragonare  il background culturale della Meloni a quello di Conte?,it,[],[],[],3,0,17,[],[],https://twitter.com/naladrof53/status/1602804775703220225,False,,0,,,,,,,,"[{'screen_name': 'Libero_official', 'name': 'Quotidiano Libero', 'id': '123920914'}]",,,,
83,1602804410693947394,1602642743523778560,2022-12-14 00:15:24 W. Europe Standard Time,2022-12-14,00:15:24,100,2559482132,francy226,francy,,"@NetflixIndia Berlusconi, meloni, salvini",it,[],[],[],0,0,0,[],[],https://twitter.com/francy226/status/1602804410693947394,False,,0,,,,,,,,"[{'screen_name': 'NetflixIndia', 'name': 'Netflix India', 'id': '4502936240'}]",,,,
89,1602803158639689728,1602803158639689728,2022-12-14 00:10:26 W. Europe Standard Time,2022-12-14,00:10:26,100,951853792936517633,toxmagato,Tox Ale,,#Meloni arriva in ritardo #Giachetti  la bacchetta  Questa é solo da 1 mese e mezzo #premier e ha giá fatto piú figure di💩 Lei che tutti gli altri messi insieme.. #GiorgiaGoHome  https://t.co/gnYgMfY9pV,it,[],[],[],25,24,82,"['meloni', 'giachetti', 'premier', 'giorgiagohome']",[],https://twitter.com/ToxMagato/status/1602803158639689728,False,,1,https://pbs.twimg.com/ext_tw_video_thumb/1602801970376544257/pu/img/hTwcTjN5rhfnWAJ9.jpg,,,,,,,[],,,,
100,1602802158302281729,1602802158302281728,2022-12-14 00:06:27 W. Europe Standard Time,2022-12-14,00:06:27,100,1562573313162915841,marco282221,Marco,,Ora per la disperazione dei sinistrati la Meloni nn potrà più screditare l’Italia inEuropa: ci hanno già pensato loro!,it,[],[],[],0,0,8,[],[],https://twitter.com/Marco282221/status/1602802158302281729,False,,0,,,,,,,,[],,,,
105,1602801927468814336,1602801927468814336,2022-12-14 00:05:32 W. Europe Standard Time,2022-12-14,00:05:32,100,1176377354580570112,stefano13112244,Stefano,,"Lurido pezzo di 💩 hai trovato pane x i tuoi denti così ci pensi due volte ad infangare le brave persone come la Sig,a Meloni non come i BASTARDI dei tuoi compari sinistroidi merdosi",it,[],[],[],0,0,0,[],[],https://twitter.com/Stefano13112244/status/1602801927468814336,False,https://twitter.com/robertosaviano/status/1602586439199358977,0,,,,,,,,[],,,,
107,1602801579572490241,1601817477536587776,2022-12-14 00:04:09 W. Europe Standard Time,2022-12-14,00:04:09,100,577464624,maulib72,blackdog72❤️🇮🇹❤️🇷🇺❤🇸🇾❤🇵🇸,,"@Crudeli45198835 Perché sono coglioni. Ne è prova  avere avuto #Berlusconi,#Renzi #Meloni come pdc. E tanti sono pure carogne. Vogliono che ci sia chi sta peggio di loro. E poi troppi servi. Inchini ai potenti e calci agli ultimi.  Troppe carogne in giro....",it,[],[],[],0,0,0,"['berlusconi', 'renzi', 'meloni']",[],https://twitter.com/maulib72/status/1602801579572490241,False,,0,,,,,,,,"[{'screen_name': 'Crudeli45198835', 'name': 'Crudelia De Mon', 'id': '1392398509253480450'}]",,,,
108,1602801558630064131,1602801558630064128,2022-12-14 00:04:04 W. Europe Standard Time,2022-12-14,00:04:04,100,1535374272121778177,michele88825591,michele,,"durante la campagna elettorale  Letta e'andato piu' volte  in europa a sparlare dell'Italia e della Meloni , dopo quanto accaduto in questi giorni  l'Europa chiedera' a Letta con quale faccia vada in giro a sparlare  della Meloni se la sua sinistra incassa soldi a nero a palate",it,[],[],[],0,0,0,[],[],https://twitter.com/michele88825591/status/1602801558630064131,False,,0,,,,,,,,[],,,,
109,1602801476929306626,1602801476929306624,2022-12-14 00:03:45 W. Europe Standard Time,2022-12-14,00:03:45,100,1520665025815404551,berlusputisputo,"MICHELE NISTA: ""BERLUS卐PUTIN MACELLAIO ASSASSINO""!",,"NESSUNO CREDA ALLA NAZISTA @GIORGIAMELONI CHE FINGE DI NON APPROVARE LE DEPORTAZIONI DA PARTE DI MACELLAIO @MUSSOLINI (FRA I DEPORTATI, PURE MIO NONNO, TORNATO VIVO A CASA, PERÒ) QS VIDEO MOSTRA L'ASSASSINA GIORGIA MELONI AMARE IL SUPER ASSASSINO MUSSOLINI  https://t.co/Chg2uHMqpG",it,"[{'screen_name': 'giorgiameloni', 'name': 'giorgia meloni', 'id': '130537001'}, {'screen_name': 'mussolini', 'name': 'fjolle fylkcfjk', 'id': '2719948348'}]",['https://www.youtube.com/watch?v=XuoXr-zjqas'],[],0,0,0,[],[],https://twitter.com/BerlusPutiSputo/status/1602801476929306626,False,,0,,,,,,,,[],,,,
110,1602801408222400513,1602801408222400512,2022-12-14 00:03:28 W. Europe Standard Time,2022-12-14,00:03:28,100,1520665025815404551,berlusputisputo,"MICHELE NISTA: ""BERLUS卐PUTIN MACELLAIO ASSASSINO""!",,"NESSUNO CREDA ALLA NAZISTA #GIORGIAMELONI CHE FINGE DI DISAPPROVARE LE DEPORTAZIONI, DA PARTE DI MACELLAIO #MUSSOLINI (FRA I DEPORTATI, PURE MIO NONNO, TORNATO VIVO A CASA, PERÒ) QS VIDEO MOSTRA L'ASSASSINA GIORGIA MELONI AMARE IL SUPER ASSASSINO MUSSOLINI  https://t.co/Chg2uHMqpG",it,[],['https://www.youtube.com/watch?v=XuoXr-zjqas'],[],0,0,0,"['giorgiameloni', 'mussolini']",[],https://twitter.com/BerlusPutiSputo/status/1602801408222400513,False,,0,,,,,,,,[],,,,
111,1602801359027314688,1602801359027314688,2022-12-14 00:03:17 W. Europe Standard Time,2022-12-14,00:03:17,100,1520665025815404551,berlusputisputo,"MICHELE NISTA: ""BERLUS卐PUTIN MACELLAIO ASSASSINO""!",,"NESSUNO CREDA ALLA NAZISTA GIORGIA MELONI CHE FINGE DI DISAPPROVARE LE DEPORTAZIONI, DA PARTE DI MACELLAIO MUSSOLINI (FRA I DEPORTATI, PURE MIO NONNO, TORNATO VIVO A CASA, PERÒ)! QS VIDEO MOSTRA L'ASSASSINA GIORGIA MELONI AMARE IL SUPER ASSASSINO MUSSOLINI  https://t.co/Chg2uHMqpG",it,[],['https://www.youtube.com/watch?v=XuoXr-zjqas'],[],0,0,0,[],[],https://twitter.com/BerlusPutiSputo/status/1602801359027314688,False,,0,,,,,,,,[],,,,
0,1603177930183655424,1603177930183655424,2022-12-15 00:59:38 W. Europe Standard Time,2022-12-15,00:59:38,100,36079217,ilmessaggeroit,Il Messaggero,,"Manovra, L’Europa dà via libera. Meloni: «Soddisfatti»  https://t.co/doc6qq5b7k",it,[],['https://www.ilmessaggero.it/politica/manovra_governo_europa_bruxelles_via_libera_giorgia_meloni-7113534.html'],[],0,0,0,[],[],https://twitter.com/ilmessaggeroit/status/1603177930183655424,False,,0,,,,,,,,[],,,,
1,1603177433276248064,1603001170305351680,2022-12-15 00:57:40 W. Europe Standard Time,2022-12-15,00:57:40,100,1316843855204016130,antonie95711274,ANTONIETTA,,"@ritadallachiesa @giangiacomomora @elio_vito Dott.ssa a me personalmente la Meloni piace anche quando dice queste cose, e' spontanea, apprezzo meno il 'politicamente corretto"". Contestare certe decisioni, da parte delle opposizioni, senza poi dare una soluzione fattibile puo' portare a certe risposte.",it,[],[],[],0,0,1,[],[],https://twitter.com/ANTONIE95711274/status/1603177433276248064,False,,0,,,,,,,,"[{'screen_name': 'ritadallachiesa', 'name': 'rita dalla chiesa🇮🇹', 'id': '429395418'}, {'screen_name': 'giangiacomomora', 'name': 'evandro antonucci', 'id': '234514265'}, {'screen_name': 'elio_vito', 'name': 'Elio Vito 🇮🇹🇪🇺🇺🇸🏳️\u200d🌈🍁🌹🌍', 'id': '1557514573'}]",,,,
5,1603176665961594881,1603176665961594880,2022-12-15 00:54:37 W. Europe Standard Time,2022-12-15,00:54:37,100,970349197349224448,rita03682158,Rita,,Porta a porta è inguardabile. Vespa da vero mercenario è sempre più schierato. Hai notato come donzelli si è rifatto il makeup in teini di atteggiamento? Forse avrà letto il mio tweet nel quale lo definivo il mastino della meloni,it,[],[],[],0,0,0,[],[],https://twitter.com/Rita03682158/status/1603176665961594881,False,https://twitter.com/CeresaRaffaele/status/1603151167151808516,0,,,,,,,,[],,,,
7,1603176601281335296,1603050019363459072,2022-12-15 00:54:21 W. Europe Standard Time,2022-12-15,00:54:21,100,22955754,y_an_ez,Y@n€z,,@analiticamente1 Idem…spero che non accada mai ma in un ballottaggio Meloni Conte Meloni tutta la vita…,it,[],[],[],1,0,1,[],[],https://twitter.com/Y_an_ez/status/1603176601281335296,False,,0,,,,,,,,"[{'screen_name': 'analiticamente1', 'name': 'analiticamente', 'id': '1497561735577972738'}]",,,,
19,1603175881278513152,1603097364692074496,2022-12-15 00:51:30 W. Europe Standard Time,2022-12-15,00:51:30,100,1585997539597320193,carladiranti,Carla diranti,,@vincenzoverzel1 @Mov5Stelle Siete poco sciacalli e oltretutto siete anche ipocriti. Vergognatevi voi e la meloni falsi,it,[],[],[],0,0,0,[],[],https://twitter.com/CarlaDiranti/status/1603175881278513152,False,,0,,,,,,,,"[{'screen_name': 'vincenzoverzel1', 'name': 'vincenzo verzella', 'id': '1325854255027195905'}, {'screen_name': 'Mov5Stelle', 'name': 'MoVimento 5 Stelle', 'id': '289400495'}]",,,,
0,1603902549974978560,1602959370618568704,2022-12-17 00:59:01 W. Europe Standard Time,2022-12-17,00:59:01,100,1494444264356564996,christian1987te,LifeIsBeautiful,,"@robertosaviano ""I processi penali si celebrano in aula, non in TV"" disse l'uomo che riempie social e mezzi di comunicazione di mezzo Mondo con i suoi piagnistei per questo processo. Se avesse un briciolo di dignità accetterebbe le conseguenze per aver insultato una donna. P. S. Meloni ha una...",it,[],[],[],1,0,0,[],[],https://twitter.com/Christian1987Te/status/1603902549974978560,False,,0,,,,,,,,"[{'screen_name': 'robertosaviano', 'name': 'Roberto Saviano', 'id': '14516324'}]",,,,
1,1603902374862622722,1603814558749147136,2022-12-17 00:58:19 W. Europe Standard Time,2022-12-17,00:58:19,100,852224481208803329,osservatore12,osservatore,,"@lauraboldrini Ma come, il diritto di critica? Mi meraviglio di lei, difende Saviano e agisce come la Meloni.",it,[],[],[],0,0,0,[],[],https://twitter.com/osservatore12/status/1603902374862622722,False,,0,,,,,,,,"[{'screen_name': 'lauraboldrini', 'name': 'Laura Boldrini', 'id': '221902171'}]",,,,
5,1603901889149558785,1603901889149558784,2022-12-17 00:56:24 W. Europe Standard Time,2022-12-17,00:56:24,100,2608133516,antondepierro,Antonello De Pierro,,Dopo la gaffe sui biscotti #oreo e l'ammoniaca non riesco ancora a capacitarmi che #Salvini è un parlamentare e ministro a spese degli italiani con 15.000 € al mese.A volte penso che se si girasse #Zelig tra i parlamentari leghisti sarebbe un successo assicurato. #lega #Meloni  https://t.co/7fQjRAOsIF,it,[],[],['https://pbs.twimg.com/media/FkI0Qu1XkAAyAoH.jpg'],14,15,54,"['oreo', 'salvini', 'zelig', 'lega', 'meloni']",[],https://twitter.com/antondepierro/status/1603901889149558785,False,,1,https://pbs.twimg.com/media/FkI0Qu1XkAAyAoH.jpg,,,,,,,[],,,,
6,1603901566691557378,1603901566691557376,2022-12-17 00:55:07 W. Europe Standard Time,2022-12-17,00:55:07,100,1342521653897605122,bufogiulio,PotereAlPopolo BariEProvincia,,"Il governo Meloni si appresta a varare in questi giorni l’annunciata riforma delle pensioni. Nuovo governo, ennesima riforma, stessa identica filosofia di intervento: risparmi, risparmi e ancora risparmi, sulla pelle di lavoratori e pensionati.  https://t.co/cWVhRVt0fw  https://t.co/AyzOYFPgsJ",it,[],['https://m.facebook.com/story.php?story_fbid=pfbid0icW42dgw28ECnnDimTeMeNuMttzbVh85dgskeKxbfx5LKczLHXtkaLfnqLpNkvtjl&id=100064686643541'],['https://pbs.twimg.com/media/FkIz-aiWQAAeTtz.jpg'],0,0,0,[],[],https://twitter.com/BufoGiulio/status/1603901566691557378,False,,1,https://pbs.twimg.com/media/FkIz-aiWQAAeTtz.jpg,,,,,,,[],,,,
8,1603901412697870336,1603901412697870336,2022-12-17 00:54:30 W. Europe Standard Time,2022-12-17,00:54:30,100,1133849050296590336,arditoad14,L'Ardito 🐻‍❄️ 🏛️,,"Ok ho la risposta al tweet di prima, scusate. Tra Meloni e Draghi cambia solo che questi sono più patetici. Rispetto a tutti, il governo gialloverde era oro.",it,[],[],[],0,0,0,[],[],https://twitter.com/ArditoAD14/status/1603901412697870336,False,https://twitter.com/dottorbarbieri/status/1603824444320976897,0,,,,,,,,[],,,,
9,1603901383857639424,1603661211178000384,2022-12-17 00:54:23 W. Europe Standard Time,2022-12-17,00:54:23,100,1206293686390276096,vincentand2,Vincentand,,@Mov5Stelle @MariaDomenicaC4 Quello che avete fatto voi è stato peggio perché fatto in un periodo diverso rispetto a quello drammatico che viviamo attualmente! Avete creato poche cose ma fatte male! Attualmente la Meloni deve prima sistemare i danni degli ultimi 10 anni compreso i vostri per poi sistemare..  https://t.co/Y2OWNJmFXh,it,[],[],"['https://pbs.twimg.com/media/FkIzyb0WQAAwlbA.jpg', 'https://pbs.twimg.com/media/FkIzy8YXwAEJA3J.jpg']",0,0,0,[],[],https://twitter.com/Vincentand2/status/1603901383857639424,False,,1,https://pbs.twimg.com/media/FkIzyb0WQAAwlbA.jpg,,,,,,,"[{'screen_name': 'Mov5Stelle', 'name': 'MoVimento 5 Stelle', 'id': '289400495'}, {'screen_name': 'MariaDomenicaC4', 'name': 'Mariolina Castellone', 'id': '1128669323470495746'}]",,,,
10,1603901209034731522,1603901209034731520,2022-12-17 00:53:41 W. Europe Standard Time,2022-12-17,00:53:41,100,2608133516,antondepierro,Antonello De Pierro,,Dopo la gaffe sui biscotti #oreo e l'ammoniaca non riesco ancora a capacitarmi che #Salvini è un parlamentare e ministro a spese degli italiani con 15.000 € al mese.Un ricercatore ne guadagna 1000.Quando si dice la meritocrazia. #lega #ammoniaca #Meloni #Berlusconi #Renzi  https://t.co/FIuzTn7csk,it,[],[],['https://pbs.twimg.com/media/FkIzlfTX0AE6J6S.jpg'],4,20,64,"['oreo', 'salvini', 'lega', 'ammoniaca', 'meloni', 'berlusconi', 'renzi']",[],https://twitter.com/antondepierro/status/1603901209034731522,False,,1,https://pbs.twimg.com/media/FkIzlfTX0AE6J6S.jpg,,,,,,,[],,,,
13,1603900581780672512,1603791571647864832,2022-12-17 00:51:12 W. Europe Standard Time,2022-12-17,00:51:12,100,1498697749453287433,gabrybab10,🥷Gabry_ella.Bab.FdD🐧LINUX 💙❤💛🥷Ubuntu/Debian,,"@P_M_1960 @rulajebreal @AgazziNora Ma cosa cavolo scrive!!   Sono anni che la destra estrema di Salvini e Meloni non aspettano che UNO, dico uno, migrante o di colore, combini un qualche reato tanto grave (ai loro occhi) da farne battage pubblicitario nonché scarnificazione nemico stile Mr. Citofono!  O'sceMmM",it,[],[],[],0,0,0,[],[],https://twitter.com/GabryBab10/status/1603900581780672512,False,,0,,,,,,,,"[{'screen_name': 'P_M_1960', 'name': 'Marco', 'id': '1004339803314446336'}, {'screen_name': 'rulajebreal', 'name': 'Base', 'id': '340418291'}, {'screen_name': 'AgazziNora', 'name': 'Nora', 'id': '1107155072'}]",,,,
14,1603900401836851207,1603900401836851200,2022-12-17 00:50:29 W. Europe Standard Time,2022-12-17,00:50:29,100,87201108,monica__russo,Monica Russo,,"Una persona deve aspettare 23 mesi per una diagnosi, #Calenda, grazie ai tagli continui alla sanità pubblica decisi ed effettuati dai precedenti governi, no dalla #Meloni che governa da due mesi. Penso che ci arriva chiunque a questa considerazione.",it,[],[],[],0,0,1,"['calenda', 'meloni']",[],https://twitter.com/Monica__Russo/status/1603900401836851207,False,https://twitter.com/CarloCalenda/status/1603821305215737856,0,,,,,,,,[],,,,
17,1603899815922139138,1603899815922139136,2022-12-17 00:48:09 W. Europe Standard Time,2022-12-17,00:48:09,100,1206211060061147136,propagandarigh1,Propaganda Right,,"Però se la Meloni vuole farsi chiamare IL Presidente del Consiglio non va bene, è autoritaria, si vuole imporre.  Le stronzate gender.  https://t.co/IR8EEMHJiD",it,[],[],['https://pbs.twimg.com/media/FkIyYQZX0AAHF5m.jpg'],0,3,25,[],[],https://twitter.com/PropagandaRigh1/status/1603899815922139138,False,,1,https://pbs.twimg.com/media/FkIyYQZX0AAHF5m.jpg,,,,,,,[],,,,
0,1606439393253793793,1606262804058513408,2022-12-24 00:59:32 W. Europe Standard Time,2022-12-24,00:59:32,100,1233523240473169924,carmeloarnone7,Carmelo Arnone,,"@FratellidItalia @GiorgiaMeloni Uno stato giusto non crea disparità eliminando la progressività delle imposte, uno stato giusto non aumenta le pensioni a discapito delle future generazioni, vede ha ragione presidente meloni questo non è uno stato giusto anche per colpa vostra",it,[],[],[],0,0,0,[],[],https://twitter.com/CarmeloArnone7/status/1606439393253793793,False,,0,,,,,,,,"[{'screen_name': 'FratellidItalia', 'name': ""Fratelli d'Italia 🇮🇹"", 'id': '1024976264'}, {'screen_name': 'GiorgiaMeloni', 'name': 'Giorgia Meloni', 'id': '130537001'}]",,,,
1,1606439015208689664,1606250874006896640,2022-12-24 00:58:02 W. Europe Standard Time,2022-12-24,00:58:02,100,455105528,dottorricky,Riccardo Scuzzarella,,@stanzaselvaggia Scusi cosa c’è da criticare ? Il nostro Presidente del Consiglio va a salutare e ringraziare le NOSTRE forze armate impegnate per la pace all’estero e con ONORE e RISPETTO indossa la giacca mimetica. Solo GRAZIE a Giorgia Meloni .,it,[],[],[],1,0,13,[],[],https://twitter.com/dottorricky/status/1606439015208689664,False,,0,,,,,,,,"[{'screen_name': 'stanzaselvaggia', 'name': 'Selvaggia Lucarelli', 'id': '416476798'}]",,,,
2,1606438947344859137,1606438947344859136,2022-12-24 00:57:45 W. Europe Standard Time,2022-12-24,00:57:45,100,1483139450779615233,metadentro,Zanna,,"Io Giorgia, madre, donna, Guinness media grazie... #Meloni #Melonivergogna  #Melonimerda  https://t.co/zKwvjOYdWi",it,[],[],['https://pbs.twimg.com/media/Fks3tatWQAIgHxx.jpg'],0,0,2,"['meloni', 'melonivergogna', 'melonimerda']",[],https://twitter.com/metadentro/status/1606438947344859137,False,,1,https://pbs.twimg.com/media/Fks3tatWQAIgHxx.jpg,,,,,,,[],,,,
3,1606438925362499584,1606438925362499584,2022-12-24 00:57:40 W. Europe Standard Time,2022-12-24,00:57:40,100,1442574363300020224,alwaysmyself87,Vanessa,,"Lo soecifico: la sanità è stata distrutta da 11 anni di governi indecenti tecnici o di SX. Ma la Meloni che replica Draghi, non fa niente di diverso. Se la smettiamo di farci la guerra tra Sx e Dx, che non esistono più, forse abbiamo mezza speranza di salvarci. Buonanotte 👋  https://t.co/zj1S0qCIUE",it,[],[],['https://pbs.twimg.com/media/Fks3sDmXEAAzMcH.jpg'],3,13,32,[],[],https://twitter.com/alwaysmyself87/status/1606438925362499584,False,,1,https://pbs.twimg.com/media/Fks3sDmXEAAzMcH.jpg,,,,,,,[],,,,
4,1606438701260759040,1606438701260759040,2022-12-24 00:56:47 W. Europe Standard Time,2022-12-24,00:56:47,100,1215779772762148865,capitanharlok6,Capitan Harlok,,Le vittime della manovra “Meloni fa cassa con noi” – infosannio – notizie online #GovernoDegliOrrori   https://t.co/gJuuYb5dOe,it,[],['https://infosannio.com/2022/12/24/le-vittime-della-manovra-meloni-fa-cassa-con-noi/'],[],0,0,0,['governodegliorrori'],[],https://twitter.com/CapitanHarlok6/status/1606438701260759040,False,,0,,,,,,,,[],,,,
5,1606438672328544257,1606014478906114048,2022-12-24 00:56:40 W. Europe Standard Time,2022-12-24,00:56:40,100,1518561197527904256,iome98725203,Checco Lioni,,"@freetime_lost @ldibartolomei Eccallà, il coglione che dà la colpa per qualsiasi atto violento ai soliti Salvini/Meloni/chiunque-di-destra, mi mancava in questo episodio.  Piddino, vero?  (Non fai nomi perché ti caghi sotto a scriverne il nome, vero eroe? cosa temi pagliaccio? denunce?)",it,[],[],[],0,0,1,[],[],https://twitter.com/IoMe98725203/status/1606438672328544257,False,,0,,,,,,,,"[{'screen_name': 'freetime_lost', 'name': 'Tutto tempo perso!', 'id': '985053152432017408'}, {'screen_name': 'ldibartolomei', 'name': 'Luca Di Bartolomei', 'id': '11258252'}]",,,,
6,1606438602308833281,1606246264844099584,2022-12-24 00:56:23 W. Europe Standard Time,2022-12-24,00:56:23,100,1197884809,pep2073,giuseppe di florio,,"@ferant210396 Se un ignorante come #Salvini fa il ministro e il cognato della #meloni lo stesso ,significa che non serve a niente il merito e la competenza",it,[],[],[],0,0,2,"['salvini', 'meloni']",[],https://twitter.com/pep2073/status/1606438602308833281,False,,0,,,,,,,,[],,,,
8,1606438315783331840,1606438315783331840,2022-12-24 00:55:15 W. Europe Standard Time,2022-12-24,00:55:15,100,755795809568952320,pointofnews,pointofnews.it,,"#meloni ha profanato Hanukkà, che non è ricorrenza identitaria.  Leggi su:  https://t.co/BI62Ra7zQQ",it,[],['https://www.pointofnews.it/ultime_notizie_su_meloni/item_4236528'],[],0,0,0,['meloni'],[],https://twitter.com/pointofnews/status/1606438315783331840,False,,0,,,,,,,,[],,,,
9,1606438184040206336,1606434941574828032,2022-12-24 00:54:43 W. Europe Standard Time,2022-12-24,00:54:43,100,429493471,gianlucamatteo,Gianluca Matteucci #facciamorete 🌈🇪🇺🇮🇹,,"@brugnolovpl @ultimora_pol Infatti... La meloni dall'opposizione aveva tutte le soluzioni: blocchi navali, 1000€ con un click, web tax, flat tax etc etc.",it,[],[],[],0,1,31,[],[],https://twitter.com/GianlucaMatteo/status/1606438184040206336,False,,0,,,,,,,,"[{'screen_name': 'brugnolovpl', 'name': 'Brugnolo Brugnoli', 'id': '317278377'}, {'screen_name': 'ultimora_pol', 'name': 'Ultimora.net - POLITICS', 'id': '1300916262369984515'}]",,,,
10,1606438093241946113,1606386775458516992,2022-12-24 00:54:22 W. Europe Standard Time,2022-12-24,00:54:22,100,1603173186236981249,martinocamerin7,Martino camerino,,"@FratellidItalia @GiorgiaMeloni Finalmente nello scenario mondiale si ritorna ad essere il numero 1, grazie alla presidentessa Giorgia Meloni.",it,[],[],[],0,0,0,[],[],https://twitter.com/Martinocamerin7/status/1606438093241946113,False,,0,,,,,,,,"[{'screen_name': 'FratellidItalia', 'name': ""Fratelli d'Italia 🇮🇹"", 'id': '1024976264'}, {'screen_name': 'GiorgiaMeloni', 'name': 'Giorgia Meloni', 'id': '130537001'}]",,,,
